{
  "authorizationGrantType": "CLIENT_CREDENTIALS",
  "clientAuthorizationMethod": "CLIENT_SECRET_BASIC",
  "clientId": "LightspeedKSeries",
  "clientName": "LightspeedKSeries",
  "clientSecret": "Example-Client-Secret",
  "providerJwkSetUri": "https://my.platform/public-keys",
  "providerTokenUri": "https://my.platform/emitter/token",
  "scopes": [
    "webhooks-api"
  ]
}